Title,Company,Location,Experience,Summary,Skills,Posting_Date,Job_URL,Job_Type,Scraped_Timestamp,Processed_Skill_Tokens,Skills_For_TFIDF,Cluster_Label
Lead Researcher - Multimodal AI,Dolby,"Bangalore, Karnataka, India",8-10 year,"This is an opportunity to play a key role in Dolby's new R&D Center in Bangalore as a Research Lead in our Advanced Technology Group ""ATG"", the research and technology arm of Dolby Labs. With...","Python Programming,C++,C Programming,Aartificial intelligence,Machine learning techniques,Leadership Skill,Natural Language Processing (NLP),PyTorch,TensorFlow,Effective communication skills",31 Jan 2025,https://www.karkidi.com/job-details/87784-lead-researcher-multimodal-ai-job,Full Time,2025-05-20T18:00:10.052733,"['python programming', 'c++', 'c programming', 'aartificial intelligence', 'machine learning techniques', 'leadership skill', 'natural language processing', 'pytorch', 'tensorflow', 'effective communication skills']",python programming c++ c programming aartificial intelligence machine learning techniques leadership skill natural language processing pytorch tensorflow effective communication skills,0
"Software Engineer III, Machine Learning, Google One",Google,"Bengaluru, Karnataka, India",4-6 year,"Minimum qualifications: Bachelor’s degree or equivalent practical experience. 2 years of experience with software development in one or more programming languages,...","Machine learning techniques,Data Analytics,Effective communication skills",29 Jan 2025,https://www.karkidi.com/job-details/87729-software-engineer-iii-machine-learning-google-one-job,Full Time,2025-05-20T18:00:10.053335,"['machine learning techniques', 'data analytics', 'effective communication skills']",machine learning techniques data analytics effective communication skills,4
"Senior Staff Software Engineer, AI Innovation and Research",Google,"Bengaluru, Karnataka, India",8-10 year,"Minimum qualifications: Bachelor's degree or equivalent practical experience 8 years of experience in software development, and with data...","Aartificial intelligence,Machine learning techniques,Algorithms,Data structuring,Effective communication skills",29 Jan 2025,https://www.karkidi.com/job-details/87728-senior-staff-software-engineer-ai-innovation-and-research-job,Full Time,2025-05-20T18:00:21.795321,"['aartificial intelligence', 'machine learning techniques', 'algorithms', 'data structuring', 'effective communication skills']",aartificial intelligence machine learning techniques algorithms data structuring effective communication skills,0
"Senior ML Compiler Engineer, Silicon",Google,"Bengaluru, Karnataka, India",6-8 year,"Minimum qualifications: Bachelor's degree in Computer Science, a related technical field, or equivalent practical experience. 5 years of experience with...","Machine learning techniques,Optimization",29 Jan 2025,https://www.karkidi.com/job-details/87727-senior-ml-compiler-engineer-silicon-job,Full Time,2025-05-20T18:00:21.796106,"['machine learning techniques', 'optimization']",machine learning techniques optimization,0
Sr. Data Engineer,Cowbell Cyber Inc.,"Pune, Maharashtra, India",4-6 year,Cowbell is signaling a new era in cyber insurance by harnessing technology and data to provide small and medium-sized enterprises (SMEs) with advanced warning of cyber risk exposures bundled with...,"Analytical and Problem solving,Design,DevOps,Apache Kafka,Data science techniques,Continuous Integration & Continuous Delivery - CI/CD,PostgreSQL,MySQL,Apache Flink,Data Engineering",27 Jan 2025,https://www.karkidi.com/job-details/87655-sr-data-engineer-job,Full Time,2025-05-20T18:00:21.796729,"['analytical and problem solving', 'design', 'devops', 'apache kafka', 'data science techniques', 'continuous integration continuous delivery - ci cd', 'postgresql', 'mysql', 'apache flink', 'data engineering']",analytical and problem solving design devops apache kafka data science techniques continuous integration continuous delivery - ci cd postgresql mysql apache flink data engineering,2
Full Stack Professional (React.JS UI expertise) with Gen AI,AT&T,"Bengaluru, Karnataka, India",12-14 year,"At AT&T we bring the world together with technology in ways you never imagined. With a range of products and services enhancing how you live, play and work, we’re keeping you connected...","Python Programming,SQL,React.js,Scala Programming,Aartificial intelligence,NumPy,Scikit-learn,Generative AI,Effective communication skills",24 Jan 2025,https://www.karkidi.com/job-details/87629-full-stack-professional-react-js-ui-expertise-with-gen-ai-job,Full Time,2025-05-20T18:00:21.797350,"['python programming', 'sql', 'react.js', 'scala programming', 'aartificial intelligence', 'numpy', 'scikit-learn', 'generative ai', 'effective communication skills']",python programming sql react.js scala programming aartificial intelligence numpy scikit-learn generative ai effective communication skills,0
Specialist Big Data Software Engineering,AT&T,"Bengaluru, Karnataka, India",6-8 year,We are seeking an innovative and detail-oriented Specialist Software Engineer (Full Stack) with over 6 years of experience in frontend and backend development. The ideal candidate will possess a...,"Java Programming,Oracle,Python Programming,MongoDB,Database,SQL,DevOps,Azure,Big Data Technology,Aartificial intelligence,Jenkins,Continuous Integration & Continuous Delivery - CI/CD,MySQL,Github,Large Language Models - LLMs",24 Jan 2025,https://www.karkidi.com/job-details/87628-specialist-big-data-software-engineering-job,Full Time,2025-05-20T18:00:21.797967,"['java programming', 'oracle', 'python programming', 'mongodb', 'database', 'sql', 'devops', 'azure', 'big data technology', 'aartificial intelligence', 'jenkins', 'continuous integration continuous delivery - ci cd', 'mysql', 'github', 'large language models - llms']",java programming oracle python programming mongodb database sql devops azure big data technology aartificial intelligence jenkins continuous integration continuous delivery - ci cd mysql github large language models - llms,3
Staff Product Designer(AI),ServiceNow,"Hyderabad, Telangana, India",4-6 year,"Team & Role At ServiceNow, we embrace representation in and from all professional and personal backgrounds and cultures. This diversity inspires passion and creativity among our teams and...","Aartificial intelligence,Database,Linux Operating system,Machine learning techniques,Python Programming,PyTorch,R Programming,Tableau,Unix Operating system",23 Jan 2025,https://www.karkidi.com/job-details/87621-staff-product-designer-ai-job,Full Time,2025-05-20T18:00:21.798549,"['aartificial intelligence', 'database', 'linux operating system', 'machine learning techniques', 'python programming', 'pytorch', 'r programming', 'tableau', 'unix operating system']",aartificial intelligence database linux operating system machine learning techniques python programming pytorch r programming tableau unix operating system,1
Senior/ Staff AI Implementation Engineer,ServiceNow,"Hyderabad, Telangana, India",6-8 year,"What you get to do in this role: Build high-quality, clean, scalable and reusable code by enforcing best practices around software engineering architecture and processes (Code Reviews,...","Aartificial intelligence,JavaScript,Linux Operating system,Python Programming,PyTorch,React.js,UI design,Unix Operating system,Vue.js",23 Jan 2025,https://www.karkidi.com/job-details/87619-senior-staff-ai-implementation-engineer-job,Full Time,2025-05-20T18:00:21.799174,"['aartificial intelligence', 'javascript', 'linux operating system', 'python programming', 'pytorch', 'react.js', 'ui design', 'unix operating system', 'vue.js']",aartificial intelligence javascript linux operating system python programming pytorch react.js ui design unix operating system vue.js,1
"Director, AI Platform",ServiceNow,"Hyderabad, Telangana, India",14-16 year,"We’re not yesterday’s IT department, we're Digital Technology. The world around us keeps changing and so do we. We’re redefining what it means to be IT with a mindset centered on...","JavaScript,Unix Operating system,UX design,UI design,Python Programming,Aartificial intelligence,Machine learning techniques,PyTorch,Algorithms,Linux Operating system,Transformer,Large Language Models - LLMs",23 Jan 2025,https://www.karkidi.com/job-details/87613-director-ai-platform-job,Full Time,2025-05-20T18:00:21.799790,"['javascript', 'unix operating system', 'ux design', 'ui design', 'python programming', 'aartificial intelligence', 'machine learning techniques', 'pytorch', 'algorithms', 'linux operating system', 'transformer', 'large language models - llms']",javascript unix operating system ux design ui design python programming aartificial intelligence machine learning techniques pytorch algorithms linux operating system transformer large language models - llms,1
Senior Staff Machine Learning Engineer,ServiceNow,"Hyderabad, Telangana, India",6-8 year,"What you get to do in this role: The Data Platform, Platform Engineering group is looking for a talented AL/ML Engineer to drive our next generation AI based solutions. You will...","Unix Operating system,Database,Aartificial intelligence,Machine learning techniques,Deep Learning,Natural Language Processing (NLP),Tableau,Linux Operating system,Large Language Models - LLMs,GPT",23 Jan 2025,https://www.karkidi.com/job-details/87610-senior-staff-machine-learning-engineer-job,Full Time,2025-05-20T18:00:21.800371,"['unix operating system', 'database', 'aartificial intelligence', 'machine learning techniques', 'deep learning', 'natural language processing', 'tableau', 'linux operating system', 'large language models - llms', 'gpt']",unix operating system database aartificial intelligence machine learning techniques deep learning natural language processing tableau linux operating system large language models - llms gpt,1
Senior Machine Learning Engineer,ServiceNow,"Hyderabad, Telangana, India",6-8 year,The Advanced Technology Group (ATG) at ServiceNow is a customer-focused innovation group building intelligent software and smart user experiences using existing and latest advanced technologies to...,"Aartificial intelligence,Linux Operating system,Machine learning techniques,Natural Language Processing (NLP),Python Programming,PyTorch,Unix Operating system",23 Jan 2025,https://www.karkidi.com/job-details/87604-senior-machine-learning-engineer-job,Full Time,2025-05-20T18:00:21.801001,"['aartificial intelligence', 'linux operating system', 'machine learning techniques', 'natural language processing', 'python programming', 'pytorch', 'unix operating system']",aartificial intelligence linux operating system machine learning techniques natural language processing python programming pytorch unix operating system,1
Staff Machine Learning Engineer - HR AI Innovation,ServiceNow,"Hyderabad, Telangana, India",4-6 year,"An HR AI Innovation Specialist focuses on leveraging cutting-edge artificial intelligence technologies within the Human Resources space to drive business transformation, improve operational...","Aartificial intelligence,Apache Kafka,Linux Operating system,Machine learning techniques,Python Programming,PyTorch,R Programming,Unix Operating system",23 Jan 2025,https://www.karkidi.com/job-details/87603-staff-machine-learning-engineer-hr-ai-innovation-job,Full Time,2025-05-20T18:00:35.031287,"['aartificial intelligence', 'apache kafka', 'linux operating system', 'machine learning techniques', 'python programming', 'pytorch', 'r programming', 'unix operating system']",aartificial intelligence apache kafka linux operating system machine learning techniques python programming pytorch r programming unix operating system,1
"Deep Learning Engineer, Datacenters",NVIDIA,"Bengaluru, Karnataka, India",4-6 year,"As NVIDIA makes inroads into the Datacenter business, our team plays a central role in getting the most out of our exponentially growing datacenter deployments as well as establishing a...","C++,Containerization,CUDA kernels,Deep Learning,Deeplearning4j,Docker,Framework,Large Language Models - LLMs,Linux Operating system,Python Programming,TensorFlow,Unix Operating system",22 Jan 2025,https://www.karkidi.com/job-details/87594-deep-learning-engineer-datacenters-job,Full Time,2025-05-20T18:00:35.032160,"['c++', 'containerization', 'cuda kernels', 'deep learning', 'deeplearning4j', 'docker', 'framework', 'large language models - llms', 'linux operating system', 'python programming', 'tensorflow', 'unix operating system']",c++ containerization cuda kernels deep learning deeplearning4j docker framework large language models - llms linux operating system python programming tensorflow unix operating system,1
"Staff Data Scientist, Products",Google,"Bengaluru, Karnataka, India",8-10 year,"Minimum qualifications: Master's degree in Statistics, Economics, Engineering, Mathematics, a related quantitative field, or equivalent practical experience. 7 years of...","Python Programming,Operations,SQL,Machine learning techniques,Data science techniques,R Programming",21 Jan 2025,https://www.karkidi.com/job-details/87569-staff-data-scientist-products-job,Full Time,2025-05-20T18:00:35.032770,"['python programming', 'operations', 'sql', 'machine learning techniques', 'data science techniques', 'r programming']",python programming operations sql machine learning techniques data science techniques r programming,4
"Customer Engineer, AI Infrastructure, Google Cloud",Google,"Bengaluru, Karnataka, India; Mumbai, Maharashtra, India; Gurugram, Haryana, India",10-12 year,"Minimum qualifications: Bachelor's degree in Computer Science, Mathematics, a related technical field, or equivalent practical experience. 10 years of experience with...","Aartificial intelligence,Machine learning techniques,PyTorch,TensorFlow,Google Cloud Platform (GCP),Optimization,Infrastructure as code,Presentation skills,Effective communication skills,High performance computing- HPC",21 Jan 2025,https://www.karkidi.com/job-details/87568-customer-engineer-ai-infrastructure-google-cloud-job,Full Time,2025-05-20T18:00:35.033402,"['aartificial intelligence', 'machine learning techniques', 'pytorch', 'tensorflow', 'google cloud platform', 'optimization', 'infrastructure as code', 'presentation skills', 'effective communication skills', 'high performance computing- hpc']",aartificial intelligence machine learning techniques pytorch tensorflow google cloud platform optimization infrastructure as code presentation skills effective communication skills high performance computing- hpc,0
Solution Architect,UiPath Inc.,"Bangalore, Karnataka, India",10-12 year,"Your Mission As a Solution Architect you work with businesses and Partners to help them leverage full potential of UiPath Automation Platform. You would involve in Designing, Developing,...","SAP,.NET,Azure,AWS,Aartificial intelligence,Google Cloud Platform (GCP),Computer Vision (CV),C# Programming",21 Jan 2025,https://www.karkidi.com/job-details/87565-solution-architect-job,Full Time,2025-05-20T18:00:35.034048,"['sap', '.net', 'azure', 'aws', 'aartificial intelligence', 'google cloud platform', 'computer vision', 'c# programming']",sap .net azure aws aartificial intelligence google cloud platform computer vision c# programming,3
Senior Sales Engineer AI/ML & IDP,UiPath Inc.,"Bangalore, Karnataka, India",6-8 year,"Your Mission As a Sales Engineer specializing in AI/ML and Intelligent Document Processing, you will be responsible for executing the technical GTM strategy, working directly with UiPath...","Sales,Aartificial intelligence,Machine learning techniques,Deep Learning,Natural Language Processing (NLP),GTM,Effective communication skills",21 Jan 2025,https://www.karkidi.com/job-details/87564-senior-sales-engineer-ai-ml-idp-job,Full Time,2025-05-20T18:00:35.034641,"['sales', 'aartificial intelligence', 'machine learning techniques', 'deep learning', 'natural language processing', 'gtm', 'effective communication skills']",sales aartificial intelligence machine learning techniques deep learning natural language processing gtm effective communication skills,0
"Prototyping Customer Engineer, Data",Google,"Bengaluru, Karnataka, India; Gurugram, Haryana, India; Mumbai, Maharashtra, India",8-10 year,"Minimum qualifications: Bachelor's degree in Computer Science, a related technical field, or equivalent practical experience. 10 years of experience in cloud computing,...","DevOps,Aartificial intelligence,Machine learning techniques,NoSQL,Docker,Kubernetes-K8s,Continuous Integration & Continuous Delivery - CI/CD,Data Analytics,Data Engineering,Data Warehousing",20 Jan 2025,https://www.karkidi.com/job-details/87514-prototyping-customer-engineer-data-job,Full Time,2025-05-20T18:00:35.035261,"['devops', 'aartificial intelligence', 'machine learning techniques', 'nosql', 'docker', 'kubernetes-k8s', 'continuous integration continuous delivery - ci cd', 'data analytics', 'data engineering', 'data warehousing']",devops aartificial intelligence machine learning techniques nosql docker kubernetes-k8s continuous integration continuous delivery - ci cd data analytics data engineering data warehousing,3
"Senior Data Scientist, Product, Real World Journeys, Search",Google,"Bengaluru, Karnataka, India",6-8 year,"Minimum qualifications: Master's degree in Statistics, Mathematics, Data Science, Engineering, Physics, Economics, a related quantitative field, or equivalent practical...","Python Programming,SQL,Data science techniques,R Programming,Effective communication skills",20 Jan 2025,https://www.karkidi.com/job-details/87513-senior-data-scientist-product-real-world-journeys-search-job,Full Time,2025-05-20T18:00:35.035884,"['python programming', 'sql', 'data science techniques', 'r programming', 'effective communication skills']",python programming sql data science techniques r programming effective communication skills,4
"Product Data Scientist, Google Play",Google,"Bengaluru, Karnataka, India",6-8 year,"Minimum qualifications: Master's degree in Statistics, Economics, Engineering, Mathematics, a related quantitative field, or equivalent practical experience 3 years of...","Python Programming,SQL,Machine learning techniques,Data science techniques,R Programming,Algorithms,Infrastructure as code",20 Jan 2025,https://www.karkidi.com/job-details/87512-product-data-scientist-google-play-job,Full Time,2025-05-20T18:00:35.036495,"['python programming', 'sql', 'machine learning techniques', 'data science techniques', 'r programming', 'algorithms', 'infrastructure as code']",python programming sql machine learning techniques data science techniques r programming algorithms infrastructure as code,4
"Senior Data Scientist, Product, Customer Engagement",Google,"Hyderabad, Telangana, India",6-8 year,"Minimum qualifications: Master's degree in Statistics, Economics, Engineering, Mathematics, a related quantitative field, or equivalent practical experience. 5 years of...","UX design,Python Programming,SQL,Data science techniques,Product Management,Data Visualization,R Programming,Data Analysis",20 Jan 2025,https://www.karkidi.com/job-details/87511-senior-data-scientist-product-customer-engagement-job,Full Time,2025-05-20T18:00:35.037127,"['ux design', 'python programming', 'sql', 'data science techniques', 'product management', 'data visualization', 'r programming', 'data analysis']",ux design python programming sql data science techniques product management data visualization r programming data analysis,4
"Data Scientist, Extended Workforce Solutions",Google,"Hyderabad, Telangana, India",4-6 year,Minimum qualifications: Master's degree in a STEM field or equivalent practical experience. 4 years of industry or PhD Data Science experience. Experience in...,"Aartificial intelligence,Machine learning techniques,Data science techniques,Keras software library,Natural Language Processing (NLP),Pandas,TensorFlow,XGBoost,Scikit-learn,Optimization,Large Language Models - LLMs",20 Jan 2025,https://www.karkidi.com/job-details/87510-data-scientist-extended-workforce-solutions-job,Full Time,2025-05-20T18:00:48.917304,"['aartificial intelligence', 'machine learning techniques', 'data science techniques', 'keras software library', 'natural language processing', 'pandas', 'tensorflow', 'xgboost', 'scikit-learn', 'optimization', 'large language models - llms']",aartificial intelligence machine learning techniques data science techniques keras software library natural language processing pandas tensorflow xgboost scikit-learn optimization large language models - llms,0
"Quantitative UX Researcher, Search",Google,"Bengaluru, Karnataka, India",4-6 year,"Minimum qualifications: Bachelor's degree in Human-Computer Interaction, Cognitive Science, Statistics, Psychology, Anthropology, related field, or equivalent practical...","C++,Data Engineering,Data science techniques,Effective communication skills,Human Computer Interaction- HCI,Java Programming,MATLAB Programming,Python Programming,R Programming,UX design",20 Jan 2025,https://www.karkidi.com/job-details/87509-quantitative-ux-researcher-search-job,Full Time,2025-05-20T18:00:48.918078,"['c++', 'data engineering', 'data science techniques', 'effective communication skills', 'human computer interaction- hci', 'java programming', 'matlab programming', 'python programming', 'r programming', 'ux design']",c++ data engineering data science techniques effective communication skills human computer interaction- hci java programming matlab programming python programming r programming ux design,4
"Staff Software Engineer, Programming Languages - Poe (Remote)","Quora, Inc.",India,4-6 year,"About Quora: Quora’s mission is to grow and share the world’s knowledge. To do so, we have two knowledge sharing products: Quora: a global knowledge sharing...","Python Programming,TypeScript,Aartificial intelligence,Effective communication skills",15 Jan 2025,https://www.karkidi.com/job-details/87462-staff-software-engineer-programming-languages-poe-remote-job,Full Time,2025-05-20T18:00:48.918686,"['python programming', 'typescript', 'aartificial intelligence', 'effective communication skills']",python programming typescript aartificial intelligence effective communication skills,0
"Software Senior Engineer, C, Distributed File Systems",Dell Technologies,"Bangalore, Karnataka, India",6-8 year,"PowerScale, a Gartner Magic Quadrant leader in Unstructured Data Storage and Management is evolving by re-architecting its stack to cater to the unique demands of the consumer market in the GenAI...","Algorithms,Generative AI,Linux Operating system,Python Programming,PyTorch,R Programming,UI design,Unix Operating system,UX design",11 Jan 2025,https://www.karkidi.com/job-details/87379-software-senior-engineer-c-distributed-file-systems-job,Full Time,2025-05-20T18:00:48.919334,"['algorithms', 'generative ai', 'linux operating system', 'python programming', 'pytorch', 'r programming', 'ui design', 'unix operating system', 'ux design']",algorithms generative ai linux operating system python programming pytorch r programming ui design unix operating system ux design,1
Software Senior Principal Engineer,Dell Technologies,"Bangalore, Karnataka, India",4-6 year,"PowerScale, a Gartner Magic Quadrant leader in Unstructured Data Storage and Management is evolving by re-architecting its stack to cater to the unique demands of the consumer market in the GenAI...","Algorithms,Analytical and Problem solving,Generative AI,Linux Operating system,Python Programming,PyTorch,UI design,Unix Operating system,UX design",11 Jan 2025,https://www.karkidi.com/job-details/87377-software-senior-principal-engineer-job,Full Time,2025-05-20T18:00:48.919942,"['algorithms', 'analytical and problem solving', 'generative ai', 'linux operating system', 'python programming', 'pytorch', 'ui design', 'unix operating system', 'ux design']",algorithms analytical and problem solving generative ai linux operating system python programming pytorch ui design unix operating system ux design,1
"Lead Software Engineer, AI Platform",Thomson Reuters Corporation,"Bengaluru, Karnataka, India",8-10 year,"In this role you will help to develop, build, design, continuously improve, and support the AI Platform at Thomson Reuters. You will participate in all stages of development, use various software...","AWS,AWS Sagemaker,Azure,AzureML,C++,Continuous Integration & Continuous Delivery - CI/CD,CSS,Generative AI,Git,Github,HTML,JavaScript,Kanban,Large Language Models - LLMs,Python Programming,TypeScript,UI design,UX design",8 Jan 2025,https://www.karkidi.com/job-details/87315-lead-software-engineer-ai-platform-job,Full Time,2025-05-20T18:00:48.920523,"['aws', 'aws sagemaker', 'azure', 'azureml', 'c++', 'continuous integration continuous delivery - ci cd', 'css', 'generative ai', 'git', 'github', 'html', 'javascript', 'kanban', 'large language models - llms', 'python programming', 'typescript', 'ui design', 'ux design']",aws aws sagemaker azure azureml c++ continuous integration continuous delivery - ci cd css generative ai git github html javascript kanban large language models - llms python programming typescript ui design ux design,3
