Title,Company,Location,Experience,Summary,Skills,Posting_Date,Job_URL,Job_Type,Scraped_Timestamp,Processed_Skill_Tokens,Skills_For_TFIDF,Cluster_Label
Machine Learning Physical Design Engineer,Google,"Bengaluru, Karnataka, India",4-6 year,"Minimum qualifications: Bachelor's degree in Electrical Engineering or a related field, or equivalent practical experience. 4 years of experience with physical design flow such...","Aartificial intelligence,Algorithms,Data structuring,Design,Machine learning techniques",20 May 2025,https://www.karkidi.com/job-details/89536-machine-learning-physical-design-engineer-job,Full Time,2025-05-20T17:56:56.028158,"['aartificial intelligence', 'algorithms', 'data structuring', 'design', 'machine learning techniques']",aartificial intelligence algorithms data structuring design machine learning techniques,0
"Staff Software Engineer - Monetization, Poe (Remote)","Quora, Inc.",India,8-10 year,"About Quora: Quora’s mission is to grow and share the world’s knowledge. To do so, we have two knowledge sharing products: Quora: a global knowledge sharing platform with over...","Aartificial intelligence,Analytical and Problem solving,API,Data Analysis,Database,Design,Effective communication skills,GraphQL,Large Language Models - LLMs,Next.JS,Python Programming,React.js,Teamwork,TypeScript",17 May 2025,https://www.karkidi.com/job-details/89511-staff-software-engineer-monetization-poe-remote-job,Full Time,2025-05-20T17:56:56.029094,"['aartificial intelligence', 'analytical and problem solving', 'api', 'data analysis', 'database', 'design', 'effective communication skills', 'graphql', 'large language models - llms', 'next.js', 'python programming', 'react.js', 'teamwork', 'typescript']",aartificial intelligence analytical and problem solving api data analysis database design effective communication skills graphql large language models - llms next.js python programming react.js teamwork typescript,2
"Staff Backend Engineer - Bot Creator Ecosystem, Poe (Remote)","Quora, Inc.",India,8-10 year,"About Quora: Quora’s mission is to grow and share the world’s knowledge. To do so, we have two knowledge sharing products: Quora: a global knowledge sharing platform with over...","Aartificial intelligence,API,Data science techniques,Design,Effective communication skills,Large Language Models - LLMs,Python Programming,Teamwork",14 May 2025,https://www.karkidi.com/job-details/89486-staff-backend-engineer-bot-creator-ecosystem-poe-remote-job,Full Time,2025-05-20T17:56:56.029800,"['aartificial intelligence', 'api', 'data science techniques', 'design', 'effective communication skills', 'large language models - llms', 'python programming', 'teamwork']",aartificial intelligence api data science techniques design effective communication skills large language models - llms python programming teamwork,0
"Senior Backend Engineer - Bot Creator Ecosystem, Poe (Remote)","Quora, Inc.",India,6-8 year,"About Quora: Quora’s mission is to grow and share the world’s knowledge. To do so, we have two knowledge sharing products: Quora: a global knowledge sharing platform with over...","Aartificial intelligence,API,Data science techniques,Design,Effective communication skills,Large Language Models - LLMs,Python Programming,Teamwork",14 May 2025,https://www.karkidi.com/job-details/89469-senior-backend-engineer-bot-creator-ecosystem-poe-remote-job,Full Time,2025-05-20T17:56:56.030515,"['aartificial intelligence', 'api', 'data science techniques', 'design', 'effective communication skills', 'large language models - llms', 'python programming', 'teamwork']",aartificial intelligence api data science techniques design effective communication skills large language models - llms python programming teamwork,0
Data Scientist Lead - AIML,JPMorgan Chase,"Bengaluru, Karnataka, India",6-8 year,"We have an opportunity to impact your career and provide an adventure where you can push the limits of what's possible. As a Lead AI/ML Engineer within our Asset and Wealth management, you...","Aartificial intelligence,Data science techniques,Large Language Models - LLMs,Machine learning techniques,Natural Language Processing (NLP),Python Programming",13 May 2025,https://www.karkidi.com/job-details/89455-data-scientist-lead-aiml-job,Full Time,2025-05-20T17:56:56.031249,"['aartificial intelligence', 'data science techniques', 'large language models - llms', 'machine learning techniques', 'natural language processing', 'python programming']",aartificial intelligence data science techniques large language models - llms machine learning techniques natural language processing python programming,0
Applied AI ML Director - Machine Learning,JPMorgan Chase,"Hyderabad, Telangana, India",12-14 year,"Elevate your career as the Director of Machine Learning Engineering, where your technical expertise and visionary leadership will shape the future of AI and ML solutions. As a Director of...","Aartificial intelligence,AWS,Azure,Google Cloud Platform (GCP),Kubernetes-K8s,Large Language Models - LLMs,Machine learning techniques",13 May 2025,https://www.karkidi.com/job-details/89454-applied-ai-ml-director-machine-learning-job,Full Time,2025-05-20T17:56:56.031921,"['aartificial intelligence', 'aws', 'azure', 'google cloud platform', 'kubernetes-k8s', 'large language models - llms', 'machine learning techniques']",aartificial intelligence aws azure google cloud platform kubernetes-k8s large language models - llms machine learning techniques,3
Senior Product Designer,Observe.AI,"Bangalore, Karnataka, India",8-10 year,"Observe.AI is transforming customer service with AI agents that speak, think, and act like your best human agents—helping enterprises automate routine customer calls and workflows, support...","Design,Leadership Skill,Machine learning techniques",13 May 2025,https://www.karkidi.com/job-details/89441-senior-product-designer-job,Full Time,2025-05-20T17:56:56.032556,"['design', 'leadership skill', 'machine learning techniques']",design leadership skill machine learning techniques,5
Manager - Machine Learning,Observe.AI,"Bangalore, Karnataka, India",8-10 year,"Observe.AI is transforming customer service with AI agents that speak, think, and act like your best human agents—helping enterprises automate routine customer calls and workflows, support...","Aartificial intelligence,Large Language Models - LLMs,Machine learning techniques,Natural Language Processing (NLP)",13 May 2025,https://www.karkidi.com/job-details/89440-manager-machine-learning-job,Full Time,2025-05-20T17:56:56.033207,"['aartificial intelligence', 'large language models - llms', 'machine learning techniques', 'natural language processing']",aartificial intelligence large language models - llms machine learning techniques natural language processing,0
Data Scientist,Spotify,"Mumbai, Maharashtra, India",6-8 year,We are looking for a Data Scientist to join the Business Analytics team at Spotify. You will work with the Regional Analytics Lead to evaluate and influence our growth strategy in India’s...,"Amazon RedShift,Apache Hadoop,Data science techniques,Google BigQuery,Google Cloud Platform (GCP),Python Programming,R Programming,SQL",13 May 2025,https://www.karkidi.com/job-details/89436-data-scientist-job,Full Time,2025-05-20T17:56:56.033880,"['amazon redshift', 'apache hadoop', 'data science techniques', 'google bigquery', 'google cloud platform', 'python programming', 'r programming', 'sql']",amazon redshift apache hadoop data science techniques google bigquery google cloud platform python programming r programming sql,5
ML Engineer,"CBRE Group, Inc.","Hyderabad, Telangana, India; Gurgaon, Haryana, India; Noida, Uttar Pradesh, India",2-4 year,"As a CBRE Data Scientist, you will optimize effectiveness and predict outcomes through business, operations, customer, and economic data in order to develop business intelligence. This job...","Algorithms,Employee life cycle,Kubernetes-K8s,Large Language Models - LLMs,Machine learning techniques,MLOps tools,Optimization",10 May 2025,https://www.karkidi.com/job-details/89394-ml-engineer-job,Full Time,2025-05-20T17:56:56.034531,"['algorithms', 'employee life cycle', 'kubernetes-k8s', 'large language models - llms', 'machine learning techniques', 'mlops tools', 'optimization']",algorithms employee life cycle kubernetes-k8s large language models - llms machine learning techniques mlops tools optimization,0
AI Solutions Engineer,Thomson Reuters Corporation,"Hyderabad, Telangana, India",2-4 year,About the Role ​Familiarizing and adopting work methodology aligning with the existing ACoE organization. Contributing to the Solutioning/POCs for key initiatives already...,"Aartificial intelligence,AWS,JavaScript,Microsoft Office suites,Natural Language Processing (NLP),Python Programming,TypeScript",10 May 2025,https://www.karkidi.com/job-details/89373-ai-solutions-engineer-job,Full Time,2025-05-20T17:57:07.936215,"['aartificial intelligence', 'aws', 'javascript', 'microsoft office suites', 'natural language processing', 'python programming', 'typescript']",aartificial intelligence aws javascript microsoft office suites natural language processing python programming typescript,0
Sr. Data Steward - Privacy Operations.,Thomson Reuters Corporation,"Bengaluru, Karnataka, India",6-8 year,"We are seeking a detail-oriented and experienced Lead to join our Data Integrity & Identity team. This team is an enabling function within our Responsible AI pillar, focused on helping business...","Aartificial intelligence,Azure,DevOps,Effective communication skills,Microsoft Office suites,Microsoft-Excel,PowerBI,Powerpoint",10 May 2025,https://www.karkidi.com/job-details/89370-sr-data-steward-privacy-operations-job,Full Time,2025-05-20T17:57:07.936973,"['aartificial intelligence', 'azure', 'devops', 'effective communication skills', 'microsoft office suites', 'microsoft-excel', 'powerbi', 'powerpoint']",aartificial intelligence azure devops effective communication skills microsoft office suites microsoft-excel powerbi powerpoint,0
Sr Product Portfolio Analyst - Portfolio Management,Thomson Reuters Corporation,"Hyderabad, Telangana, India",6-8 year,We are seeking an innovative professional to join our team as a Sr Product Portfolio Analyst within the CPO Organization at Thomson Reuters. This role is ideal for an individual who possesses a...,"Aartificial intelligence,Data science techniques,Database,Large Language Models - LLMs,Machine learning techniques,Microsoft-Excel,Operations,PowerBI,Product Analytics,Product Management",10 May 2025,https://www.karkidi.com/job-details/89369-sr-product-portfolio-analyst-portfolio-management-job,Full Time,2025-05-20T17:57:07.937548,"['aartificial intelligence', 'data science techniques', 'database', 'large language models - llms', 'machine learning techniques', 'microsoft-excel', 'operations', 'powerbi', 'product analytics', 'product management']",aartificial intelligence data science techniques database large language models - llms machine learning techniques microsoft-excel operations powerbi product analytics product management,0
Senior Data Migration Analyst,Thomson Reuters Corporation,"Hyderabad, Telangana, India",6-8 year,"As an employee at Thomson Reuters, you will play a role in shaping and leading the global knowledge economy. Our technology drives global markets and helps professionals around the world make...","Alteryx,Data Analytics,Data science techniques,Data Visualization,ETL frameworks,IT,Microsoft-Excel,PowerBI,SQL,Tableau",10 May 2025,https://www.karkidi.com/job-details/89365-senior-data-migration-analyst-job,Full Time,2025-05-20T17:57:07.938143,"['alteryx', 'data analytics', 'data science techniques', 'data visualization', 'etl frameworks', 'it', 'microsoft-excel', 'powerbi', 'sql', 'tableau']",alteryx data analytics data science techniques data visualization etl frameworks it microsoft-excel powerbi sql tableau,4
Data Engineering Manager,Thomson Reuters Corporation,"Hyderabad, Telangana, India",4-6 year,"The Manager, Software Development Engineering leads a team of technical experts in successfully executing technology projects and solutions that align with the strategy and have broad business...","Analytical and Problem solving,Apache Hadoop,AWS,Big Data Technology,Data Engineering,Data management,Data Visualization,Effective communication skills,Google BigQuery,Java Programming,Machine learning techniques,Python Programming,React.js,Scala Programming,SPARK Programming",10 May 2025,https://www.karkidi.com/job-details/89364-data-engineering-manager-job,Full Time,2025-05-20T17:57:07.938720,"['analytical and problem solving', 'apache hadoop', 'aws', 'big data technology', 'data engineering', 'data management', 'data visualization', 'effective communication skills', 'google bigquery', 'java programming', 'machine learning techniques', 'python programming', 'react.js', 'scala programming', 'spark programming']",analytical and problem solving apache hadoop aws big data technology data engineering data management data visualization effective communication skills google bigquery java programming machine learning techniques python programming react.js scala programming spark programming,5
Software Engineer,Circana,"Pune, Maharashtra, India",2-4 year,"Let’s be unstoppable together! At Circana, we are fueled by our passion for continuous learning and growth, we seek and share feedback freely, and we celebrate victories both big and small...","Analytical and Problem solving,Apache Hadoop,Apache Hive,Effective communication skills,ETL frameworks,Oracle,PostgreSQL,Scala Programming,SPARK Programming,SQL",9 May 2025,https://www.karkidi.com/job-details/89361-software-engineer-job,Full Time,2025-05-20T17:57:07.939315,"['analytical and problem solving', 'apache hadoop', 'apache hive', 'effective communication skills', 'etl frameworks', 'oracle', 'postgresql', 'scala programming', 'spark programming', 'sql']",analytical and problem solving apache hadoop apache hive effective communication skills etl frameworks oracle postgresql scala programming spark programming sql,2
Engineering Manager,Circana,"Bangalore, Karnataka, India; Pune, Maharashtra, India",16-18 year,"Let’s be unstoppable together! At Circana, we are fueled by our passion for continuous learning and growth, we seek and share feedback freely, and we celebrate victories both big and small...","Apache Hadoop,Effective communication skills,SPARK Programming",9 May 2025,https://www.karkidi.com/job-details/89360-engineering-manager-job,Full Time,2025-05-20T17:57:07.939936,"['apache hadoop', 'effective communication skills', 'spark programming']",apache hadoop effective communication skills spark programming,5
Senior Software Engineer,Circana,"Bangalore, Karnataka, India",4-6 year,"Let’s be unstoppable together! At Circana, we are fueled by our passion for continuous learning and growth, we seek and share feedback freely, and we celebrate victories both big and small...","Analytical and Problem solving,Apache Hive,Effective communication skills,PySpark,Python Programming,Scala Programming,Shell Scripting language,SPARK Programming,SQL",9 May 2025,https://www.karkidi.com/job-details/89359-senior-software-engineer-job,Full Time,2025-05-20T17:57:07.940535,"['analytical and problem solving', 'apache hive', 'effective communication skills', 'pyspark', 'python programming', 'scala programming', 'shell scripting language', 'spark programming', 'sql']",analytical and problem solving apache hive effective communication skills pyspark python programming scala programming shell scripting language spark programming sql,2
"Associate Software Developer, Machine Learning",Kinaxis,"Chennai, Tamil Nadu, India",0-2 year,The team is responsible for applying machine learning algorithms to develop intelligent supply chains. The uniqueness of the team is that it performs at the intersection of technology and real...,"AWS,Azure,Docker,Effective communication skills,Google Cloud Platform (GCP),Kubernetes-K8s,Machine learning techniques,Pandas,Python Programming",9 May 2025,https://www.karkidi.com/job-details/89345-associate-software-developer-machine-learning-job,Full Time,2025-05-20T17:57:07.941135,"['aws', 'azure', 'docker', 'effective communication skills', 'google cloud platform', 'kubernetes-k8s', 'machine learning techniques', 'pandas', 'python programming']",aws azure docker effective communication skills google cloud platform kubernetes-k8s machine learning techniques pandas python programming,3
"Staff Service Reliability Engineer - Python, Splunk & Datascience - 14 to 18 years - Bangalore",Cisco,"Bangalore, Karnataka, India",14-16 year,"We are seeking a highly skilled Staff Service Reliability Engineer to lead the deployment and optimization of Splunk for monitoring non-production, Engineering research and development equipment...","Aartificial intelligence,Data science techniques,Deep Learning,IT,Machine learning techniques,Python Programming,Splunk",8 May 2025,https://www.karkidi.com/job-details/89331-staff-service-reliability-engineer-python-splunk-datascience-14-to-18-years-bangalore-job,Full Time,2025-05-20T17:57:07.941695,"['aartificial intelligence', 'data science techniques', 'deep learning', 'it', 'machine learning techniques', 'python programming', 'splunk']",aartificial intelligence data science techniques deep learning it machine learning techniques python programming splunk,0
Software Engineering Technical Leader: AI/ML Platform Experience ( Golang/Python + DSA + Kubernetes ),Cisco,"Bangalore, Karnataka, India",10-12 year,"We are seeking a leader to define the architecture for our Kubernetes platform, mentor a team of junior software engineers, and drive expertise in AI/ML. In this role, you will design and develop...","Aartificial intelligence,Continuous Integration & Continuous Delivery - CI/CD,GoLang,Kubernetes-K8s,Large Language Models - LLMs,Machine learning techniques,MLOps tools,Python Programming",8 May 2025,https://www.karkidi.com/job-details/89330-software-engineering-technical-leader-ai-ml-platform-experience-golang-python-dsa-kubernetes-job,Full Time,2025-05-20T17:57:19.573809,"['aartificial intelligence', 'continuous integration continuous delivery - ci cd', 'golang', 'kubernetes-k8s', 'large language models - llms', 'machine learning techniques', 'mlops tools', 'python programming']",aartificial intelligence continuous integration continuous delivery - ci cd golang kubernetes-k8s large language models - llms machine learning techniques mlops tools python programming,3
Sr. Data Scientist,PayPal,"Bangalore, Karnataka, India; Chennai, Tamil Nadu, India",4-6 year,"Your way to impact You believe in data-driven decisions and use data to answer business questions You are hyper-analytical, intellectually honest, and extremely passionate about...","Data science techniques,Effective communication skills,Leadership Skill,Python Programming,R Programming,SQL,Writing",8 May 2025,https://www.karkidi.com/job-details/89310-sr-data-scientist-job,Full Time,2025-05-20T17:57:19.574561,"['data science techniques', 'effective communication skills', 'leadership skill', 'python programming', 'r programming', 'sql', 'writing']",data science techniques effective communication skills leadership skill python programming r programming sql writing,4
Director Data Science & Data Engineering,eBay,"Bengaluru, Karnataka, India",12-14 year,About the Role We're reimagining how people discover products in eCommerce—and we're looking for a visionary leader who blends technical depth with product intuition. If you're passionate...,"Aartificial intelligence,Data Engineering,Data pipelines,Data science techniques,Ecommerce,Large Language Models - LLMs,Python Programming,SQL",8 May 2025,https://www.karkidi.com/job-details/89299-director-data-science-data-engineering-job,Full Time,2025-05-20T17:57:19.575254,"['aartificial intelligence', 'data engineering', 'data pipelines', 'data science techniques', 'ecommerce', 'large language models - llms', 'python programming', 'sql']",aartificial intelligence data engineering data pipelines data science techniques ecommerce large language models - llms python programming sql,0
"Sr. Mngr, Knowledge Management Science",eBay,"Bengaluru, Karnataka, India",8-10 year,"We’re building the future of eCommerce product discovery, and we need a data-driven, AI-savvy problem solver to help us, do it. This is an outstanding role at the intersection of data...","Aartificial intelligence,Data science techniques,Ecommerce,Effective communication skills,Machine learning techniques,Python Programming,SQL",8 May 2025,https://www.karkidi.com/job-details/89298-sr-mngr-knowledge-management-science-job,Full Time,2025-05-20T17:57:19.575892,"['aartificial intelligence', 'data science techniques', 'ecommerce', 'effective communication skills', 'machine learning techniques', 'python programming', 'sql']",aartificial intelligence data science techniques ecommerce effective communication skills machine learning techniques python programming sql,4
Senior Manager Data Science,eBay,"Bengaluru, Karnataka, India",4-6 year,"At eBay, we're more than a global ecommerce leader — we’re changing the way the world shops and sells. Our platform empowers millions of buyers and sellers in more than 190 markets around the...","Aartificial intelligence,Data science techniques,Large Language Models - LLMs,Python Programming,SQL",8 May 2025,https://www.karkidi.com/job-details/89297-senior-manager-data-science-job,Full Time,2025-05-20T17:57:19.576494,"['aartificial intelligence', 'data science techniques', 'large language models - llms', 'python programming', 'sql']",aartificial intelligence data science techniques large language models - llms python programming sql,0
"Data Scientist, Knowledge management",eBay,"Bengaluru, Karnataka, India",4-6 year,"About Team and role We’re building the future of eCommerce product discovery, and we need a data-driven, AI-savvy problem solver to help us, do it. This is a unique role at the...","Aartificial intelligence,Data science techniques,Large Language Models - LLMs,Machine learning techniques,Python Programming,SQL",8 May 2025,https://www.karkidi.com/job-details/89296-data-scientist-knowledge-management-job,Full Time,2025-05-20T17:57:19.577099,"['aartificial intelligence', 'data science techniques', 'large language models - llms', 'machine learning techniques', 'python programming', 'sql']",aartificial intelligence data science techniques large language models - llms machine learning techniques python programming sql,0
"Principal MTS, Machine Learning T28",eBay,"Bengaluru, Karnataka, India",10-12 year,"The Product Knowledge team is at the epicenter of eBay’s Tech-driven, Customer-centric overhaul. Our team is entrusted with creating and using eBay’s Product Knowledge - a vast Big Data system...","Big Data Technology,Data pipelines,Java Programming,Leadership Skill,Machine learning techniques,Python Programming,Scala Programming",8 May 2025,https://www.karkidi.com/job-details/89295-principal-mts-machine-learning-t28-job,Full Time,2025-05-20T17:57:19.577718,"['big data technology', 'data pipelines', 'java programming', 'leadership skill', 'machine learning techniques', 'python programming', 'scala programming']",big data technology data pipelines java programming leadership skill machine learning techniques python programming scala programming,5
"Manager, ML Engineering Tech Leader T27",eBay,"Bengaluru, Karnataka, India",12-14 year,"​The Product Knowledge team is at the epicenter of eBay’s Tech-driven, Customer-centric overhaul. Our team is entrusted with creating and using eBay’s Product Knowledge - a vast Big Data...","Apache Hadoop,Java Programming,Leadership Skill,Machine learning techniques,Natural Language Processing (NLP),People management,Product Analytics,Product Management,Python Programming,SPARK Programming,SQL",8 May 2025,https://www.karkidi.com/job-details/89294-manager-ml-engineering-tech-leader-t27-job,Full Time,2025-05-20T17:57:19.578324,"['apache hadoop', 'java programming', 'leadership skill', 'machine learning techniques', 'natural language processing', 'people management', 'product analytics', 'product management', 'python programming', 'spark programming', 'sql']",apache hadoop java programming leadership skill machine learning techniques natural language processing people management product analytics product management python programming spark programming sql,5
"Director, Applied Research T28",eBay,"Bengaluru, Karnataka, India",12-14 year,"​The Product Knowledge team is at the epicenter of eBay’s Tech-driven, Customer-centric overhaul. Our team is entrusted with creating and using eBay’s Product Knowledge - a vast Big Data...","Aartificial intelligence,Deep Learning,Machine learning techniques,Natural Language Processing (NLP),Operations,Optimization",8 May 2025,https://www.karkidi.com/job-details/89293-director-applied-research-t28-job,Full Time,2025-05-20T17:57:19.578927,"['aartificial intelligence', 'deep learning', 'machine learning techniques', 'natural language processing', 'operations', 'optimization']",aartificial intelligence deep learning machine learning techniques natural language processing operations optimization,0
